{
  "$schema": "https://json-schema.org/draft/2020-12/schema",
  "type": "object",
  "additionalProperties": false,
  "required": ["verdict", "summary", "findings", "prior_findings_status", "open_questions"],
  "properties": {
    "verdict": { "type": "string", "enum": ["approve", "needs-revision"] },
    "summary": { "type": "string", "minLength": 1 },
    "findings": {
      "type": "array",
      "items": {
        "type": "object",
        "additionalProperties": false,
        "required": ["id", "severity", "category", "title", "detail", "anchor", "confidence", "recommendation"],
        "properties": {
          "id": { "type": "string", "minLength": 1 },
          "severity": { "type": "string", "enum": ["blocker", "major", "minor"] },
          "category": { "type": "string", "minLength": 1 },
          "title": { "type": "string", "minLength": 1 },
          "detail": { "type": "string", "minLength": 1 },
          "anchor": { "type": "string", "minLength": 1 },
          "confidence": { "type": "number", "minimum": 0, "maximum": 1 },
          "recommendation": { "type": "string", "minLength": 1 }
        }
      }
    },
    "prior_findings_status": {
      "type": "array",
      "items": {
        "type": "object",
        "additionalProperties": false,
        "required": ["id", "status", "evidence"],
        "properties": {
          "id": { "type": "string", "minLength": 1 },
          "status": { "type": "string", "enum": ["resolved", "partially_resolved", "unresolved"] },
          "evidence": { "type": "string", "minLength": 1 }
        }
      }
    },
    "open_questions": { "type": "array", "items": { "type": "string", "minLength": 1 } }
  }
}
