{
  "verdict": "needs-revision",
  "summary": "no-ship:存在 1 个 blocker。",
  "findings": [
    {
      "id": "F1",
      "severity": "blocker",
      "category": "correctness",
      "title": "限流中间件未处理 Redis 连接失败",
      "detail": "Redis 不可用时中间件抛未捕获异常,导致所有请求 500。",
      "anchor": "src/middleware/rateLimit.ts:42",
      "confidence": 0.9,
      "recommendation": "Redis 不可用时降级放行并告警,不要让请求 500。"
    }
  ],
  "prior_findings_status": [],
  "open_questions": []
}
